{
  "milestone": "C17b-c-d",
  "mode": "fictional_review_only",
  "case_id": "L7",
  "procedure_stage": "complaint",
  "input_digests": {
    "case": "9dff1a74d19f55243d0ecadf1137cad206c4dcaadb6def900f03ee65fae197dd",
    "upstream_c17": "24266219e9c7f481bba5f2c0ffc6f3e21732b2f9cf2f55d4fbd15515445d4859",
    "c12": "8299f2c66c5e6d0d91b17bdce375d941e2cf763747b4ce4407dc7d1a3a13ae05",
    "c13": "d6589759d7fd072e98cc57ceeac65c65b796933e45bd3276f38f8c0843c78aac"
  },
  "catalog_digests": {
    "EU": "584291c8f04c18a1deb79289e1e0250057963568925db88c3a74de9654c26996",
    "SE": "068d677b2269a4e53f026e2cb8bb0d0933be7caf6fe7be624bc19b6114a5da1e",
    "TR": "8e15d05a080abfddfce6e8047b011975e9c06b7caeb1286c65e0bea6571d8440"
  },
  "source_assurance_warning": "National-law modules contain curated identity notes, not complete authoritative statutes; C1 active Article 2(2)(a) targeted repair does not establish full-source completeness; 21 C1 identity-only notes persist; no real-case merits review.",
  "legal_violation_status": "not_determined",
  "verified_legal_merits": false,
  "send_authorized": false,
  "requires_human_review": true,
  "c17_questions": [
    {
      "rule_id": "se:c16:jo-supervision-boundary",
      "topic": "JO supervision is distinct from appeal and decision annulment",
      "citations_for_human_check": [
        {
          "source_id": "se:src:jo-guidance-en",
          "pinpoint_hint": "JO may criticise but does not change/annul decisions; complaint public-record and timeliness cautions.",
          "assurance": "country_source_summary_only"
        },
        {
          "source_id": "se:src:admin-act",
          "pinpoint_hint": "Administrative remedies and appeal require the applicable specific legal route.",
          "assurance": "country_source_summary_only"
        }
      ],
      "factual_items_for_verification": [
        "element:procedure.stage",
        "fact:jo_complaint_route_invoked",
        "fact:decision_overturn_requested",
        "fact:appeal_route_explained"
      ],
      "exception_questions": [
        "Do not assert JO can annul consular decisions; check competent appeal body, appeal clock, public record and data minimisation."
      ],
      "question": "Please clarify the factual and procedural basis for the matter described as: JO supervision is distinct from appeal and decision annulment.",
      "legal_violation_status": "not_determined"
    }
  ],
  "remedy_candidates": [
    {
      "remedy_id": "se:c17:jo-supervisory-complaint",
      "category": "supervisory_complaint",
      "authority_ref": "se:authority:jo",
      "priority_class": "nonbinding_parallel_review",
      "deadline": {
        "kind": "normally_two_year_rule",
        "rule": "JO ordinarily declines matters over two years old; exceptions require assessment; not an appeal filing period.",
        "trigger_event": "date_of_complained_of_conduct",
        "calculation": "human_only"
      },
      "prerequisites_to_verify": [
        "Verify that the challenged conduct was an act of an authority/official within JO jurisdiction",
        "Check timing and whether a separate appeal is available",
        "Review disclosure and public-record risks"
      ],
      "powers_to_verify": [
        "JO may investigate and criticise maladministration"
      ],
      "limits": [
        "JO cannot reverse the underlying decision, issue the visa or award damages",
        "Not all complaints are investigated",
        "The complaint and attachments normally become public documents subject to secrecy rules",
        "Ordinary appeal timelines continue independently"
      ],
      "evidence_to_preserve": [
        "Chronology, exact official conduct, written communications, file number, relevant decision, minimized copies"
      ],
      "source_refs": [
        "se:src:jo-complaint",
        "se:src:jo-guidance-en"
      ],
      "filing_channel_for_review": "JO official complaint instructions; verify current format and confidentiality treatment.",
      "intended_outcome_for_review": "Seek independent supervisory scrutiny of alleged maladministration, not an individual visa remedy.",
      "matched_rule_ids": [
        "se:c16:jo-supervision-boundary"
      ],
      "jurisdiction": "SE",
      "status": "candidate_for_human_review",
      "human_review_required": true,
      "outstanding_checks": [
        "Verify jurisdiction and present official source text",
        "Verify factual predicates and contrary evidence",
        "Verify current authority competence, prerequisites and deadlines",
        "Check whether this route affects or leaves untouched other remedies"
      ]
    }
  ],
  "excluded_routes": [],
  "parallelism_warnings": [
    "Candidate order is a review queue, not a recommendation or sequence of legally required steps.",
    "Clarification, SOLVIT, Commission or JO complaints do not automatically suspend national appeal deadlines.",
    "Do not calculate dates, send correspondence, or infer violation or eligibility from a fictional source-anchored predicate.",
    "Review potentially urgent formal appeal independently and in parallel; no waiting step is authorized."
  ],
  "correspondence_drafts": [
    {
      "remedy_id": "se:c17:jo-supervisory-complaint",
      "format": "supervisory_complaint",
      "recipient_placeholder": "[VERIFY CURRENT COMPETENT AUTHORITY]",
      "text": "DRAFT SUPERVISORY COMPLAINT — FICTIONAL REVIEW ONLY / DO NOT SEND\nTo: [VERIFY CURRENT COMPETENT AUTHORITY; NO ADDRESS INSERTED]\nRe: [FICTIONAL L7 — REPLACE WITH HUMAN-VERIFIED REFERENCE ONLY IF AUTHORIZED]\n\nThe fictional review record raises the following matters for verification: JO supervision is distinct from appeal and decision annulment.\nThese are unverified allegations and source-qualified questions, not findings.\n\nSubject to verification of competence and the underlying facts, I request supervisory examination of the described conduct. I do not seek reversal or monetary compensation from this body.\n\nRelevant source identifiers for a human to inspect: se:src:jo-complaint, se:src:jo-guidance-en.\nDocuments and dates must be checked independently; attach only material required and lawfully shareable.\nThe recipient, competence, applicable law, filing requirements and deadline remain unverified.\n",
      "send_authorized": false,
      "human_review_required": true
    }
  ],
  "decision_gate": "blocked_pending_source_factual_and_human_review",
  "missing_prerequisites": [
    "Official current and operative national legislation and any exceptions",
    "Authenticated communications and independent fact assessment",
    "Current competent recipient and applicable court/appeal procedure",
    "Decision service dates, extension/suspension rules and filing proof",
    "Independent legal-semantic review including unresolved C15f, 21 incomplete C1 source notes, and independent full-source verification",
    "Private-data authorization and trustworthy human approval before any real use"
  ],
  "review_facts": [
    {
      "rule_id": "se:c16:jo-supervision-boundary",
      "facts_to_check": [
        "element:procedure.stage",
        "fact:jo_complaint_route_invoked",
        "fact:decision_overturn_requested",
        "fact:appeal_route_explained"
      ]
    }
  ]
}
